{
  "$schema":"https://json-schema.org/draft/2020-12/schema","$id":"https://example.local/decision/decision-request.schema.json","title":"Decision intelligence request","type":"object","required":["decisionId","version","title","domain","riskLevel","criteria","options","evidence"],
  "properties":{"decisionId":{"type":"string","minLength":1},"version":{"type":"string","minLength":1},"title":{"type":"string","minLength":1},"domain":{"type":"string","minLength":1},"riskLevel":{"enum":["low","medium","high","critical"]},"minimumSeparation":{"type":"number","minimum":0,"maximum":1},"criteria":{"type":"array","minItems":2,"items":{"type":"object","required":["criterionId","name","weight","min","max","direction"],"properties":{"criterionId":{"type":"string"},"name":{"type":"string"},"weight":{"type":"number","exclusiveMinimum":0},"min":{"type":"number"},"max":{"type":"number"},"direction":{"enum":["maximize","minimize"]},"unit":{"type":"string"},"minimumReliability":{"type":"number","minimum":0,"maximum":1}}}},"options":{"type":"array","minItems":2},"evidence":{"type":"array","minItems":1},"constraints":{"type":"array"}},"additionalProperties":true
}
