{"decisionId":"hiring-demo","version":"1","title":"Synthetic hiring support example","domain":"employment","riskLevel":"high","minimumSeparation":0.05,"criteria":[{"criterionId":"validated_skill","name":"Validated work sample","weight":0.6,"min":0,"max":100,"direction":"maximize"},{"criterionId":"structured_interview","name":"Structured interview score","weight":0.4,"min":0,"max":100,"direction":"maximize"}],"constraints":[],"evidence":[{"evidenceId":"e1","source":"work-sample","observedAt":"2026-08-30T00:00:00Z","status":"verified","reliability":0.9},{"evidenceId":"e2","source":"structured-panel","observedAt":"2026-08-30T00:00:00Z","status":"verified","reliability":0.9}],"options":[{"optionId":"candidate-a","name":"Candidate A","measurements":{"validated_skill":{"value":90,"evidenceIds":["e1"]},"structured_interview":{"value":80,"evidenceIds":["e2"]}}},{"optionId":"candidate-b","name":"Candidate B","measurements":{"validated_skill":{"value":80,"evidenceIds":["e1"]},"structured_interview":{"value":85,"evidenceIds":["e2"]}}}]}
